<?xml version="1.0" encoding="UTF-8" ?>

<!--
# Licensed under the Apache License, Version 2.0 (the "License");
# you may not use this file except in compliance with the License.
# You may obtain a copy of the License at
#
#      https://www.apache.org/licenses/LICENSE-2.0
#
# Unless required by applicable law or agreed to in writing, software
# distributed under the License is distributed on an "AS IS" BASIS,
# WITHOUT WARRANTIES OR CONDITIONS OF ANY KIND, either express or implied.
# See the License for the specific language governing permissions and
# limitations under the License.
-->

<xs:schema xmlns:xs="http://www.w3.org/2001/XMLSchema">
  <xs:element name="playlist">
    <xs:complexType>
      <xs:sequence>
        <xs:element type="xs:string" name="include" minOccurs="0"/>
        <xs:element name="test" maxOccurs="unbounded" minOccurs="1">
          <xs:complexType>
            <xs:all>
              <xs:element name="disables" maxOccurs="1" minOccurs="0">
                <xs:complexType>
                  <xs:sequence>
                    <xs:element name="disable" maxOccurs="unbounded" minOccurs="1">
                      <xs:complexType>
                        <xs:all>
                          <xs:element type="xs:string" name="comment" maxOccurs="1" minOccurs="1"/>
                          <xs:element type="xs:string" name="variation" maxOccurs="1" minOccurs="0"/>
                          <xs:element type="xs:string" name="version" maxOccurs="1" minOccurs="0"/>
                          <xs:element type="xs:string" name="impl" maxOccurs="1" minOccurs="0"/>
                          <xs:element type="xs:string" name="vendor" maxOccurs="1" minOccurs="0"/>
                          <xs:element type="xs:string" name="platform" maxOccurs="1" minOccurs="0"/>
                          <xs:element type="xs:string" name="testflag" maxOccurs="1" minOccurs="0"/>
                        </xs:all>
                      </xs:complexType>
                    </xs:element>
                  </xs:sequence>
                </xs:complexType>
              </xs:element>
              <xs:element type="xs:string" name="testCaseName" maxOccurs="1" minOccurs="1"/>
              <xs:element name="variations" maxOccurs="1" minOccurs="0">
                <xs:complexType>
                  <xs:sequence>
                    <xs:element type="xs:string" name="variation" maxOccurs="unbounded" minOccurs="1"/>
                  </xs:sequence>
                </xs:complexType>
              </xs:element>
              <xs:element type="xs:string" name="command" maxOccurs="1" minOccurs="1"/>
              <xs:element type="xs:string" name="capabilities" maxOccurs="1" minOccurs="0"/>
              <xs:element type="xs:string" name="platformRequirements" maxOccurs="1" minOccurs="0"/>
              <xs:element type="xs:string" name="platform" maxOccurs="1" minOccurs="0"/>
              <xs:element type="xs:string" name="aot" maxOccurs="1" minOccurs="0"/>
              <xs:element name="levels" maxOccurs="1" minOccurs="0">
                <xs:complexType>
                  <xs:sequence>
                    <xs:element type="xs:string" name="level" maxOccurs="unbounded" minOccurs="1"/>
                  </xs:sequence>
                </xs:complexType>
              </xs:element>
              <xs:element name="groups" maxOccurs="1" minOccurs="0">
                <xs:complexType>
                  <xs:sequence>
                    <xs:element type="xs:string" name="group" maxOccurs="unbounded" minOccurs="1"/>
                  </xs:sequence>
                </xs:complexType>
              </xs:element>
              <xs:element name="types" maxOccurs="1" minOccurs="0">
                <xs:complexType>
                  <xs:sequence>
                    <xs:element type="xs:string" name="type" maxOccurs="unbounded" minOccurs="1"/>
                  </xs:sequence>
                </xs:complexType>
              </xs:element>
              <xs:element name="impls" maxOccurs="1" minOccurs="0">
                <xs:complexType>
                  <xs:sequence>
                    <xs:element type="xs:string" name="impl" maxOccurs="unbounded" minOccurs="1"/>
                  </xs:sequence>
                </xs:complexType>
              </xs:element>
              <xs:element name="vendors" maxOccurs="1" minOccurs="0">
                <xs:complexType>
                  <xs:sequence>
                    <xs:element type="xs:string" name="vendor" maxOccurs="unbounded" minOccurs="1"/>
                  </xs:sequence>
                </xs:complexType>
              </xs:element>
              <xs:element name="versions" maxOccurs="1" minOccurs="0">
                <xs:complexType>
                  <xs:sequence>
                    <xs:element type="xs:string" name="version" maxOccurs="unbounded" minOccurs="1"/>
                  </xs:sequence>
                </xs:complexType>
              </xs:element>
            </xs:all>
          </xs:complexType>
        </xs:element>
      </xs:sequence>
    </xs:complexType>
  </xs:element>
</xs:schema>